{
  "id": "hikvision-ds-2cd2163g2-i",
  "brand": "Hikvision",
  "model": "DS-2CD2163G2-I",
  "aliases": [
    "AcuSense 6MP Fixed Dome"
  ],
  "type": "dome",
  "connectivity": [
    "ethernet"
  ],
  "resolution": {
    "megapixels": 6,
    "max_width": 3200,
    "max_height": 1800,
    "label": "6MP"
  },
  "sensor": "1/2.4\" Progressive Scan CMOS",
  "lens": {
    "count": 1,
    "focal_length_mm": "2.8 / 4 (fixed options)",
    "aperture": "F1.6",
    "varifocal": false
  },
  "field_of_view_deg": "103 horizontal (2.8mm)",
  "night_vision": {
    "type": "ir",
    "range_m": 40
  },
  "power": {
    "method": "PoE (802.3af) / DC 12V"
  },
  "storage": {
    "onboard": true,
    "max_microsd_gb": 256,
    "nvr_compatible": true,
    "cloud": false
  },
  "protocols": [
    "onvif",
    "rtsp"
  ],
  "ip_rating": "IP67",
  "audio": {
    "microphone": false,
    "speaker": false,
    "two_way": false
  },
  "features": [
    "AcuSense human/vehicle classification",
    "120 dB WDR",
    "H.265+",
    "IK10"
  ],
  "sources": [
    "https://www.hikvision.com/en/products/IP-Products/Network-Cameras/Pro-Series-EasyIP-/"
  ],
  "power_source": [
    "poe",
    "dc"
  ],
  "configs": {
    "frigate": {
      "detect": {
        "width": 1280,
        "height": 720,
        "fps": 5
      },
      "rtsp_url_template": "rtsp://{user}:{pass}@{ip}:554/Streaming/Channels/101",
      "best_substream": "rtsp://{user}:{pass}@{ip}:554/Streaming/Channels/102"
    },
    "home_assistant": {
      "integration": "onvif",
      "notes": "Use ONVIF integration. Default ONVIF port 80. Enable in Configuration > Network > Integration Protocol."
    },
    "blue_iris": {
      "profile": "Hikvision",
      "notes": "Select 'Hikvision' profile. Use main stream for recording, sub stream for live view."
    }
  },
  "last_verified": "2026-07-06"
}
