{
  "id": "hikvision-ds-2cd1123g2-i",
  "brand": "Hikvision",
  "model": "DS-2CD1123G2-I",
  "type": "dome",
  "connectivity": [
    "ethernet"
  ],
  "resolution": {
    "megapixels": 2,
    "max_width": 1920,
    "max_height": 1080,
    "label": "1080p (2MP)"
  },
  "sensor": "1/2.9\" Progressive Scan CMOS",
  "lens": {
    "count": 1,
    "focal_length_mm": "2.8/4",
    "varifocal": false
  },
  "field_of_view_deg": "104 (2.8mm)/81 (4mm) horizontal",
  "night_vision": {
    "type": "ir",
    "range_m": 30
  },
  "power": {
    "method": "PoE (802.3af) / DC 12V"
  },
  "storage": {
    "onboard": false,
    "nvr_compatible": true,
    "cloud": false
  },
  "protocols": [
    "onvif",
    "rtsp"
  ],
  "ip_rating": "IP67",
  "audio": {
    "microphone": false,
    "speaker": false,
    "two_way": false
  },
  "features": [
    "AcuSense human/vehicle detection",
    "EXIR 2.0 850nm IR up to 30m",
    "IK10 vandal-resistant",
    "no onboard audio or microSD on base -I"
  ],
  "release_year": 2023,
  "sources": [
    "https://download.axilogi.com/Hikvision/Datasheet/DS-2CD1123G2-I.pdf"
  ],
  "power_source": [
    "poe",
    "dc"
  ],
  "configs": {
    "frigate": {
      "detect": {
        "width": 1280,
        "height": 720,
        "fps": 5
      },
      "rtsp_url_template": "rtsp://{user}:{pass}@{ip}:554/Streaming/Channels/101",
      "best_substream": "rtsp://{user}:{pass}@{ip}:554/Streaming/Channels/102"
    },
    "home_assistant": {
      "integration": "onvif",
      "notes": "Use ONVIF integration. Default ONVIF port 80."
    },
    "blue_iris": {
      "profile": "Hikvision",
      "notes": "Select 'Hikvision' profile. Use main stream for recording, sub stream for live view."
    }
  },
  "video": {
    "codecs": [
      "H.265",
      "H.264"
    ],
    "max_fps": 30,
    "streams": [
      {
        "name": "main",
        "resolution": "1920x1080",
        "fps": 30,
        "codec": "H.265"
      }
    ]
  },
  "environment": [
    "outdoor"
  ],
  "last_verified": "2026-07-07",
  "release_notes": "2MP AcuSense fixed dome with EXIR 2.0 IR (30m) and IK10; base -I has no audio or microSD slot."
}
