{
  "id": "bosch-nde-3703-al",
  "brand": "Bosch",
  "model": "FLEXIDOME outdoor 3100i IR (NDE-3703-AL)",
  "type": "dome",
  "connectivity": [
    "ethernet"
  ],
  "power_source": [
    "poe"
  ],
  "resolution": {
    "label": "5MP",
    "max_width": 2592,
    "max_height": 1944,
    "megapixels": 5
  },
  "video": {
    "codecs": [
      "H.264",
      "H.265",
      "M-JPEG"
    ],
    "max_fps": 30
  },
  "sensor": "1/2.7 inch CMOS",
  "lens": {
    "count": 1,
    "focal_length_mm": "3.3-10.2",
    "aperture": "F1.6-3.29",
    "varifocal": true
  },
  "field_of_view_deg": "30.1-101.4 (horizontal)",
  "night_vision": {
    "type": "ir",
    "range_m": 30
  },
  "power": {
    "method": "PoE IEEE 802.3af/802.3at Type 1, Class 3 (4.5-7.9 W)",
    "poe_class": 3
  },
  "storage": {
    "onboard": true,
    "max_microsd_gb": 2048,
    "cloud": false,
    "nvr_compatible": true
  },
  "protocols": [
    "onvif",
    "rtsp",
    "http"
  ],
  "ip_rating": "IP66",
  "features": [
    "High Dynamic Range (HDR) 120 dB",
    "IVA Pro Buildings deep-learning person/vehicle detection",
    "Built-in IR illuminator up to 30 m (850 nm)",
    "Motorized varifocal zoom/focus",
    "IK10 vandal resistance",
    "Trusted Platform Module (TPM) / Secure Element",
    "Triple streaming / Bosch Intelligent Streaming",
    "NDAA compliant",
    "ONVIF Profile S/G/T/M"
  ],
  "operating_temp_c": "-30 to 50 (continuous); up to 55 IR on / 60 IR off",
  "dimensions_mm": "137 (dia) x 111 (H)",
  "weight_g": 789.5,
  "environment": [
    "outdoor"
  ],
  "sources": [
    "https://assets.catalog.boschbuildingtechnologies.com/public/documents/NDE_3703_AL_Data_sheet_enUS_121021001867.pdf",
    "https://netcamcenter.de/de/produkte/ip-kameras/nde-3703-al",
    "https://commerce.boschsecurity.com/jp/en/FLEXIDOME-outdoor-3100i-IR/p/F.01U.406.612/"
  ],
  "markets": [
    "EU",
    "global"
  ],
  "configs": {
    "frigate": {
      "detect": {
        "width": 640,
        "height": 480,
        "fps": 5
      },
      "rtsp_url_template": "rtsp://{user}:{pass}@{ip}:554/?inst=1",
      "best_substream": "rtsp://{user}:{pass}@{ip}:554/?inst=2",
      "recommended_stream_type": "go2rtc",
      "verified": false,
      "notes": "Bosch official RTSP scheme: /?inst=1 main, /?inst=2 sub (per Bosch 'RTSP usage with Bosch Video IP Devices'). Default admin user is 'service' (no factory default password — set one first). ONVIF Profile S/G (T/M on INTEOX). Not individually bench-tested."
    },
    "home_assistant": {
      "integration": "onvif",
      "connection_type": "local_push",
      "onvif_events": true,
      "notes": "Generic ONVIF integration; Bosch CPP cameras are ONVIF Profile S/G compliant. Use the 'service' account."
    },
    "blue_iris": {
      "profile": "ONVIF",
      "notes": "Bosch — use the ONVIF/RTSP (or 'Bosch') profile; default admin user is 'service'."
    }
  },
  "last_verified": "2026-07-06"
}
