{
  "id": "acti-q75",
  "brand": "ACTi",
  "model": "Q75",
  "type": "panoramic",
  "connectivity": [
    "ethernet"
  ],
  "resolution": {
    "megapixels": 20,
    "max_width": 2592,
    "max_height": 1944,
    "label": "20MP"
  },
  "sensor": "1/1.8\" CMOS",
  "lens": {
    "count": 4,
    "focal_length_mm": "5.5 (fixed)",
    "aperture": "F1.8",
    "varifocal": false
  },
  "field_of_view_deg": "180 horizontal / 47 vertical",
  "night_vision": {
    "type": "ir",
    "range_m": 30
  },
  "power": {
    "method": "DC 12V / AC 24V / High PoE (IEEE 802.3at); 25.5 W (PoE)"
  },
  "ip_rating": "IP66",
  "audio": {
    "microphone": false,
    "speaker": false,
    "two_way": true
  },
  "dimensions_mm": "196 (diameter) x 188.4",
  "weight_g": 2500,
  "operating_temp_c": "-40 to 50",
  "environment": [
    "outdoor"
  ],
  "video": {
    "codecs": [
      "H.265",
      "H.264"
    ],
    "max_fps": 30
  },
  "features": [
    "Advanced WDR (100 dB)",
    "built-in analytics: Object Based Motion Detection, Tampering Detection",
    "audio: 2-way, Line-in, Line-out (no built-in mic/speaker)",
    "ONVIF Compliant: Yes, Profile S, Profile Q, Profile G, Profile T",
    "ONVIF confirmed, but no Network Protocol & Service / RTSP row on official spec sheet -- protocols left unconfirmed",
    "cross-checked against the official downloadable PDF datasheet (separate from the web specifications widget) -- same result, protocols genuinely not documented"
  ],
  "sources": [
    "https://www.acti.com/product/Q75?tab=specifications",
    "https://download.acti.com/?id=26615"
  ],
  "power_source": [
    "poe",
    "dc",
    "ac-mains"
  ],
  "last_verified": "2026-07-03"
}
