{
  "id": "vigi-c345",
  "brand": "VIGI",
  "model": "VIGI C345",
  "type": "bullet",
  "connectivity": [
    "ethernet"
  ],
  "power_source": [
    "poe",
    "dc"
  ],
  "resolution": {
    "megapixels": 4,
    "max_width": 2688,
    "max_height": 1520,
    "label": "4MP"
  },
  "video": {
    "codecs": [
      "H.265+",
      "H.265",
      "H.264+",
      "H.264"
    ],
    "max_fps": 30,
    "streams": [
      {
        "name": "main",
        "resolution": "2688x1520",
        "fps": 30,
        "codec": "H.265+"
      },
      {
        "name": "sub",
        "resolution": "640x480",
        "fps": 30,
        "codec": "H.265"
      }
    ]
  },
  "sensor": "1/2.7\" Progressive Scan CMOS",
  "lens": {
    "focal_length_mm": "2.8/4/6",
    "aperture": "F1.6",
    "varifocal": false
  },
  "night_vision": {
    "type": "hybrid",
    "range_m": 30
  },
  "power": {
    "method": "PoE / DC",
    "consumption_w": 10.7,
    "voltage": "12V DC / 802.3af/at",
    "poe_class": 0
  },
  "storage": {
    "onboard": true,
    "max_microsd_gb": 512,
    "nvr_compatible": true,
    "cloud": true
  },
  "protocols": [
    "onvif",
    "rtsp",
    "http",
    "rtmp"
  ],
  "ip_rating": "IP67",
  "audio": {
    "microphone": true,
    "speaker": true,
    "two_way": true
  },
  "features": [
    "people & vehicle analytics",
    "human & vehicle classification",
    "person detection",
    "vehicle detection",
    "line-crossing detection",
    "intrusion detection",
    "region entering detection",
    "region exiting detection",
    "object abandoned detection",
    "object removal detection",
    "loitering detection",
    "abnormal sound detection",
    "scene change detection",
    "active defense",
    "full-color night vision",
    "wdr 120db"
  ],
  "operating_temp_c": "-30 to 60",
  "dimensions_mm": "184 x 74 x 74",
  "weight_g": 525,
  "environment": [
    "outdoor"
  ],
  "markets": [
    "global"
  ],
  "sources": [
    "https://www.vigi.com/en/business-networking/vigi-network-camera/vigi-c345/"
  ],
  "configs": {
    "frigate": {
      "rtsp_url_template": "rtsp://{user}:{pass}@{ip}:554/stream1",
      "best_substream": "rtsp://{user}:{pass}@{ip}:554/stream2",
      "recommended_stream_type": "go2rtc",
      "verified": false
    },
    "home_assistant": {
      "integration": "onvif",
      "connection_type": "local_push",
      "two_way_audio": true,
      "onvif_events": true
    },
    "blue_iris": {
      "profile": "Generic/ONVIF",
      "notes": "TP-Link VIGI is ONVIF/RTSP-conformant — use the Generic/ONVIF (or RTSP) profile; main /stream1, sub /stream2."
    }
  },
  "status": "available",
  "last_verified": "2026-07-06"
}
