{
  "id": "axis-m3115-lve",
  "brand": "Axis",
  "model": "M3115-LVE",
  "type": "dome",
  "connectivity": [
    "ethernet"
  ],
  "resolution": {
    "megapixels": 2,
    "max_width": 1920,
    "max_height": 1080,
    "label": "1080p"
  },
  "sensor": "1/2.9\" Progressive Scan CMOS",
  "lens": {
    "count": 1,
    "focal_length_mm": "2.8",
    "aperture": "F2.0",
    "varifocal": false
  },
  "field_of_view_deg": "105",
  "night_vision": {
    "type": "ir",
    "range_m": 20
  },
  "power": {
    "method": "PoE (802.3af)"
  },
  "storage": {
    "onboard": true,
    "nvr_compatible": true,
    "cloud": false
  },
  "protocols": [
    "onvif",
    "rtsp"
  ],
  "ip_rating": "IP66",
  "audio": {
    "microphone": false,
    "speaker": false,
    "two_way": false
  },
  "features": [
    "Forensic WDR",
    "OptimizedIR",
    "flat face (reduces light reflection)",
    "H.265/H.264 Zipstream",
    "affordable 1080p dome",
    "IK10"
  ],
  "sources": [
    "https://www.axis.com/products/axis-m3115-lve"
  ],
  "markets": [
    "global"
  ],
  "last_verified": "2026-07-04",
  "power_source": [
    "poe"
  ],
  "configs": {
    "frigate": {
      "detect": {
        "width": 640,
        "height": 480,
        "fps": 5
      },
      "rtsp_url_template": "rtsp://{user}:{pass}@{ip}/axis-media/media.amp?resolution=1920x1080",
      "best_substream": "rtsp://{user}:{pass}@{ip}/axis-media/media.amp?resolution=640x480"
    },
    "home_assistant": {
      "integration": "axis",
      "notes": "Native Axis integration with auto-discovery via Zeroconf."
    },
    "blue_iris": {
      "profile": "Axis",
      "notes": "Select 'Axis' profile. Auto-discovery via ONVIF usually works."
    }
  }
}
