{
  "id": "ring-spotlight-cam-plus-solar",
  "brand": "Ring",
  "model": "Spotlight Cam Plus (Solar)",
  "aliases": [
    "Ring Spotlight Cam Plus Solar"
  ],
  "type": "bullet",
  "connectivity": [
    "wifi"
  ],
  "release_year": 2022,
  "resolution": {
    "megapixels": 2,
    "max_width": 1920,
    "max_height": 1080,
    "label": "1080p HD"
  },
  "lens": {
    "count": 1,
    "varifocal": false
  },
  "field_of_view_deg": "140 horizontal",
  "night_vision": {
    "type": "color",
    "range_m": 8
  },
  "power": {
    "method": "Solar panel + rechargeable battery"
  },
  "storage": {
    "onboard": false,
    "nvr_compatible": false,
    "cloud": true
  },
  "protocols": [
    "http"
  ],
  "ip_rating": "IP55",
  "audio": {
    "microphone": true,
    "speaker": true,
    "two_way": true
  },
  "features": [
    "1080p HD with LED spotlights",
    "solar-powered with battery backup",
    "color night vision",
    "motion-activated lights and siren",
    "two-way audio",
    "customizable motion zones",
    "Ring Protect plan",
    "Alexa integration"
  ],
  "sources": [
    "https://ring.com/products/spotlight-cam-plus-solar"
  ],
  "power_source": [
    "battery",
    "solar"
  ],
  "markets": ["global"],
  "last_verified": "2026-07-04"
}
