{
  "id": "bosch-nds-5704-f360",
  "brand": "Bosch",
  "model": "FLEXIDOME panoramic 5100i (NDS-5704-F360)",
  "type": "panoramic",
  "connectivity": [
    "ethernet"
  ],
  "power_source": [
    "poe"
  ],
  "resolution": {
    "label": "12MP",
    "megapixels": 12,
    "max_width": 3000,
    "max_height": 3000
  },
  "video": {
    "max_fps": 30,
    "codecs": [
      "H.264",
      "H.265",
      "M-JPEG"
    ]
  },
  "sensor": "1/2.3 inch CMOS",
  "lens": {
    "focal_length_mm": "1.26",
    "aperture": "F2.0",
    "count": 1,
    "varifocal": false
  },
  "field_of_view_deg": "182",
  "night_vision": {
    "type": "none"
  },
  "power": {
    "method": "PoE (IEEE 802.3af)"
  },
  "storage": {
    "onboard": true,
    "nvr_compatible": true
  },
  "protocols": [
    "onvif",
    "rtsp"
  ],
  "ip_rating": "IP42",
  "audio": {
    "microphone": true
  },
  "features": [
    "360° panoramic overview without blind spots",
    "High Dynamic Range (120 dB WDR)",
    "Edge or client-side dewarping",
    "IVA Pro Buildings",
    "IVA Pro Perimeter",
    "Intelligent Audio Analytics",
    "IK08 impact protection",
    "ONVIF Profile S/G/M/T",
    "Built-in microSD card slot",
    "Day/Night"
  ],
  "operating_temp_c": "-10 to 45",
  "dimensions_mm": "Ø110 x 47.7",
  "release_year": 2021,
  "environment": [
    "indoor"
  ],
  "sources": [
    "https://commerce.boschsecurity.com/xl/en/FLEXIDOME-panoramic-5100i/p/F.01U.385.629/",
    "https://www.a1securitycameras.com/bosch-nds-5704-f360-12mp-indoor-fisheye-ip-security-camera-with-built-in-microphone.html",
    "https://www.a1securitycameras.com/content/product_documents/59009/Bosch-NDS-5704-F360-Datasheet-A1.pdf",
    "https://netcamcenter.de/de/produkte/ip-kameras/nds-5704-f360"
  ],
  "markets": [
    "EU",
    "global"
  ],
  "configs": {
    "frigate": {
      "detect": {
        "width": 640,
        "height": 480,
        "fps": 5
      },
      "rtsp_url_template": "rtsp://{user}:{pass}@{ip}:554/?inst=1",
      "best_substream": "rtsp://{user}:{pass}@{ip}:554/?inst=2",
      "recommended_stream_type": "go2rtc",
      "verified": false,
      "notes": "Bosch official RTSP scheme: /?inst=1 main, /?inst=2 sub (per Bosch 'RTSP usage with Bosch Video IP Devices'). Default admin user is 'service' (no factory default password — set one first). ONVIF Profile S/G (T/M on INTEOX). Not individually bench-tested."
    },
    "home_assistant": {
      "integration": "onvif",
      "connection_type": "local_push",
      "onvif_events": true,
      "notes": "Generic ONVIF integration; Bosch CPP cameras are ONVIF Profile S/G compliant. Use the 'service' account."
    },
    "blue_iris": {
      "profile": "ONVIF",
      "notes": "Bosch — use the ONVIF/RTSP (or 'Bosch') profile; default admin user is 'service'."
    }
  },
  "last_verified": "2026-07-06"
}
