{
  "id": "acti-y71",
  "brand": "ACTi",
  "model": "Y71",
  "type": "turret",
  "connectivity": [
    "coax"
  ],
  "resolution": {
    "megapixels": 2,
    "max_width": 1920,
    "max_height": 1080,
    "label": "2MP"
  },
  "sensor": "1/3\" CMOS",
  "lens": {
    "count": 1,
    "focal_length_mm": "2.8 (fixed)",
    "aperture": "F2.0",
    "varifocal": false
  },
  "field_of_view_deg": "90.5 horizontal / 49.6 vertical",
  "night_vision": {
    "type": "ir",
    "range_m": 30
  },
  "power": {
    "method": "DC 12V (adapter not included), Power Jack 2.1x5.5mm; 2.88W consumption"
  },
  "storage": {
    "onboard": false,
    "nvr_compatible": true,
    "cloud": false
  },
  "protocols": [],
  "ip_rating": "IP67",
  "dimensions_mm": "118 (diameter) x 96",
  "weight_g": 182,
  "operating_temp_c": "-30 to 60",
  "environment": [
    "outdoor"
  ],
  "video": {
    "codecs": [],
    "max_fps": 30
  },
  "features": [
    "analog turret (TVI/AHD/CVI/CVBS)",
    "IR LED 30m",
    "extreme WDR 130dB",
    "30fps@2MP",
    "NDAA compliant",
    "IP67",
    "outdoor",
    "no Ethernet port -- analog-only, no RTSP/ONVIF (coax to DVR/NVR)"
  ],
  "sources": [
    "https://www.acti.com/product/Y71",
    "https://download.acti.com/?id=31920"
  ],
  "power_source": [
    "dc"
  ],
  "last_verified": "2026-07-03"
}
