{
  "id": "amcrest-ip2m-841b",
  "brand": "Amcrest",
  "model": "IP2M-841B 1080p WiFi Bullet",
  "type": "box",
  "connectivity": [
    "wifi"
  ],
  "environment": [
    "indoor"
  ],
  "release_year": 2019,
  "resolution": {
    "megapixels": 2,
    "label": "1080p HD"
  },
  "field_of_view_deg": "90",
  "night_vision": {
    "type": "ir",
    "range_m": 10
  },
  "power": {
    "method": "DC 12V"
  },
  "storage": {
    "onboard": true,
    "max_microsd_gb": 256,
    "nvr_compatible": true,
    "cloud": false
  },
  "protocols": [
    "rtsp"
  ],
  "audio": {
    "microphone": true,
    "speaker": true,
    "two_way": true
  },
  "features": [
    "motion detection",
    "H.264",
    "RTSP",
    "entry-level popular",
    "355° pan / 90° tilt",
    "auto-tracking"
  ],
  "sources": [
    "https://amcrest.com/2mp-wifi-camera-pan-tilt-ip2m-841b-v3.html"
  ],
  "markets": [
    "global"
  ],
  "last_verified": "2026-07-04",
  "power_source": [
    "dc"
  ],
  "configs": {
    "frigate": {
      "detect": {
        "width": 640,
        "height": 480,
        "fps": 5
      },
      "rtsp_url_template": "rtsp://{user}:{pass}@{ip}:554/cam/realmonitor?channel=1&subtype=0",
      "best_substream": "rtsp://{user}:{pass}@{ip}:554/cam/realmonitor?channel=1&subtype=1"
    },
    "home_assistant": {
      "integration": "amcrest",
      "notes": "Native Amcrest integration or ONVIF. Default ONVIF port 80."
    },
    "blue_iris": {
      "profile": "Dahua",
      "notes": "Select 'Dahua' profile. Amcrest uses Dahua protocol. Also works with 'Amcrest' profile if available."
    }
  }
}
