{
  "id": "godrej-eve-pro-outdoor",
  "brand": "Godrej",
  "model": "Eve Pro Outdoor",
  "type": "bullet",
  "connectivity": [
    "wifi"
  ],
  "release_year": 2024,
  "markets": [
    "IN"
  ],
  "resolution": {
    "megapixels": 3,
    "max_width": 2048,
    "max_height": 1536,
    "label": "3MP 2K"
  },
  "sensor": "CMOS",
  "lens": {
    "count": 1,
    "focal_length_mm": "3.6 (fixed)",
    "aperture": "F2.0",
    "varifocal": false
  },
  "field_of_view_deg": "107 horizontal",
  "night_vision": {
    "type": "color",
    "range_m": 20
  },
  "power": {
    "method": "DC 12V"
  },
  "storage": {
    "onboard": true,
    "max_microsd_gb": 128,
    "nvr_compatible": false,
    "cloud": false
  },
  "protocols": [
    "http"
  ],
  "ip_rating": "IP67",
  "audio": {
    "microphone": true,
    "speaker": false,
    "two_way": false
  },
  "features": [
    "Godrej EVE outdoor bullet",
    "3MP color night vision",
    "IP67",
    "EVE app",
    "no subscription",
    "₹5,999"
  ],
  "sources": [
    "https://shop.godrejsecure.com/products/Godrej-EVE-Pro-Green-4MP-Solar-Powered-Camera/1161"
  ],
  "power_source": [
    "dc"
  ],
  "last_verified": "2026-07-06"
}
