{
  "id": "imou-aov-dual",
  "brand": "IMOU",
  "model": "AOV Dual",
  "type": "dual-lens",
  "connectivity": [
    "wifi",
    "4g"
  ],
  "power_source": [
    "battery",
    "solar"
  ],
  "resolution": {
    "megapixels": 5,
    "label": "3K (5MP dual-lens)"
  },
  "lens": {
    "count": 2,
    "varifocal": false
  },
  "night_vision": {
    "type": "hybrid",
    "range_m": 25
  },
  "power": {
    "method": "10000mAh rechargeable battery; 8W solar panel included (charges to -15C)"
  },
  "storage": {
    "onboard": true,
    "max_microsd_gb": 512,
    "nvr_compatible": false,
    "cloud": true
  },
  "protocols": [
    "http"
  ],
  "audio": {
    "microphone": true,
    "speaker": true,
    "two_way": true
  },
  "features": [
    "dual-lens (fixed wide lens + pan/tilt lens)",
    "8x zoom",
    "Always-On-Video (AOV)",
    "smart tracking / auto-follow",
    "human & vehicle detection",
    "110 dB siren",
    "4G LTE + Wi-Fi auto-switch",
    "128GB SD pre-inserted"
  ],
  "release_notes": "Dual-lens wire-free AOV battery camera (fixed wide + PT lens). Sensor, focal lengths, IP rating and codecs not stated on accessible official sources.",
  "sources": [
    "https://www.imou.com/en/product/detail/aov-dual",
    "https://www.imou.com/en/product/specs/aov-dual"
  ],
  "last_verified": "2026-07-05",
  "status": "available",
  "configs": {
    "frigate": {
      "notes": "100% wire-free battery camera — it sleeps between events and does not expose a continuous local RTSP stream, so Frigate/local-NVR use is not supported. Recording is via the Imou Life app + cloud and on-device microSD.",
      "verified": false
    }
  }
}
