{
  "id": "reolink-rlc-830a",
  "brand": "Reolink",
  "model": "RLC-830A",
  "type": "ptz",
  "connectivity": [
    "ethernet"
  ],
  "resolution": {
    "megapixels": 8,
    "max_width": 3840,
    "max_height": 2160,
    "label": "4K UHD"
  },
  "sensor": "1/2.7\" CMOS",
  "lens": {
    "count": 1,
    "focal_length_mm": "4.0 (fixed)",
    "aperture": "F1.6",
    "varifocal": false
  },
  "field_of_view_deg": "88 horizontal",
  "night_vision": {
    "type": "hybrid",
    "range_m": 30
  },
  "power": {
    "method": "PoE (802.3af) / DC 12V",
    "consumption_w": 12
  },
  "storage": {
    "onboard": true,
    "max_microsd_gb": 256,
    "nvr_compatible": true,
    "cloud": false
  },
  "protocols": [
    "rtsp"
  ],
  "ip_rating": "IP65",
  "audio": {
    "microphone": true,
    "speaker": true,
    "two_way": true
  },
  "features": [
    "355deg pan / 90deg tilt",
    "auto-tracking",
    "spotlight color night vision",
    "person/vehicle/animal detection",
    "no subscription"
  ],
  "release_year": 2022,
  "sources": [
    "https://reolink.com/product/rlc-830a/"
  ],
  "last_verified": "2026-07-04",
  "power_source": [
    "poe",
    "dc"
  ],
  "configs": {
    "frigate": {
      "detect": {
        "width": 1280,
        "height": 720,
        "fps": 5
      },
      "rtsp_url_template": "rtsp://{user}:{pass}@{ip}:554/h264Preview_01_main",
      "best_substream": "rtsp://{user}:{pass}@{ip}:554/h264Preview_01_sub"
    },
    "home_assistant": {
      "integration": "reolink",
      "notes": "Native Reolink integration auto-discovers via ONVIF on port 8000."
    },
    "blue_iris": {
      "profile": "Reolink",
      "notes": "Select 'Reolink' profile. If not listed, use Generic/ONVIF with RTSP path /h264Preview_01_main."
    }
  },
  "video": {
    "codecs": [
      "H.265"
    ],
    "max_fps": 25,
    "streams": [
      {
        "name": "main",
        "resolution": "3840x2160",
        "fps": 25,
        "codec": "H.265"
      },
      {
        "name": "sub",
        "resolution": "unknown",
        "fps": 10,
        "codec": "H.265"
      }
    ]
  },
  "dimensions_mm": "228 x 110 x 147",
  "weight_g": 1200,
  "operating_temp_c": "-10 to 55",
  "environment": [
    "outdoor"
  ]
}
