{
  "id": "kedacom-ipc2240-hn-s",
  "brand": "Kedacom",
  "model": "IPC2240-HN-S",
  "aliases": ["IPC2240-HN-S-L0210"],
  "type": "dome",
  "connectivity": ["ethernet"],
  "power_source": ["poe", "dc"],
  "resolution": { "megapixels": 2.0, "max_width": 1920, "max_height": 1080, "label": "1080p" },
  "video": { "codecs": ["H.265", "H.264", "MJPEG"], "max_fps": 30 },
  "sensor": "1/3\" progressive scan CMOS",
  "lens": { "focal_length_mm": "2.1 (L0210)", "varifocal": false },
  "field_of_view_deg": "143.3",
  "night_vision": { "type": "none" },
  "power": { "method": "DC12V / PoE (IEEE802.3af)", "consumption_w": 11 },
  "protocols": ["onvif", "rtsp", "http"],
  "audio": { "microphone": true, "two_way": true },
  "features": ["digital WDR", "3D noise reduction", "motion detection", "tampering detection", "guard line", "enter guard area", "exit guard area"],
  "operating_temp_c": "-40 to 60",
  "dimensions_mm": "Ø97.62 x 67.65",
  "environment": ["indoor"],
  "markets": ["global"],
  "sources": ["https://www.kedacom.com/en/bqwlsxj/861.jhtml"],
  "last_verified": "2026-07-04",
  "configs": {
    "frigate": { "rtsp_url_template": "rtsp://{user}:{pass}@{ip}:554/id=0", "best_substream": "rtsp://{user}:{pass}@{ip}:554/id=1", "verified": false },
    "home_assistant": { "integration": "onvif" },
    "blue_iris": { "profile": "ONVIF" }
  },
  "status": "available"
}
